{
  "abandoned_action_ids": [
    "P3-P1-HEAD-L",
    "P3-P1-HEAD-R",
    "P3-P1-HEAD-CROSS",
    "P3-P1-NECK-L",
    "P3-P1-NECK-R",
    "P3-P1-TORSO-L",
    "P3-P1-TORSO-R",
    "P3-P1-RIB-CROSS",
    "P3-P1-WAIST-CROSS",
    "P3-P1-SHOULDER-L",
    "P3-P1-SHOULDER-R",
    "P3-P1-NEAR-OUT",
    "P3-P1-NEAR-IN",
    "P3-P1-FAR-OUT",
    "P3-P1-FAR-IN",
    "P3-P1-HAND-A",
    "P3-P1-HAND-B",
    "P3-P1-PELVIS-L",
    "P3-P1-PELVIS-R",
    "P3-P1-PELVIS-CROSS",
    "P3-P1-LEG-A-OUT",
    "P3-P1-LEG-A-IN",
    "P3-P1-LEG-B-OUT",
    "P3-P1-LEG-B-IN",
    "P3-P1-KNEE-A",
    "P3-P1-KNEE-B",
    "P3-P1-FOOT-A",
    "P3-P1-FOOT-B",
    "P3-P2-DELETE-HAND-A",
    "P3-P2-DELETE-HAND-B",
    "P3-P2-DELETE-FOOT-A",
    "P3-P2-DELETE-FOOT-B",
    "P3-P2-TORSO-L",
    "P3-P2-TORSO-R",
    "P3-P2-NEAR-OUT",
    "P3-P2-NEAR-IN",
    "P3-P2-HEAD-L",
    "P3-P3-PELVIS-L",
    "P3-P3-PELVIS-R",
    "P3-P3-PELVIS-CROSS",
    "P3-P3-LEG-A-OUT",
    "P3-P3-LEG-A-IN",
    "P3-P3-LEG-B-OUT",
    "P3-P3-LEG-B-IN",
    "P3-P4-FAR-OUT",
    "P3-P4-FAR-IN",
    "P3-P4-FOOT-A",
    "P3-P4-FOOT-B",
    "P3-P4-HEAD-CROSS",
    "P3-P4-RIB-CROSS",
    "P3-P5-NEAR-OUT",
    "P3-P5-NEAR-IN",
    "P3-P5-PELVIS-L",
    "P3-P5-PELVIS-R",
    "P3-P6-WHOLE-RIB",
    "P3-P6-WHOLE-LEG-A",
    "P3-P6-WHOLE-LEG-B"
  ],
  "abandoned_local_review_ids": [
    "P3_primary_masses:pass_01:attached_object",
    "P3_primary_masses:pass_01:far_arm",
    "P3_primary_masses:pass_01:head_hair",
    "P3_primary_masses:pass_01:near_arm",
    "P3_primary_masses:pass_01:pelvis_legs",
    "P3_primary_masses:pass_01:torso_orientation",
    "P3_primary_masses:pass_02:attached_object",
    "P3_primary_masses:pass_02:far_arm",
    "P3_primary_masses:pass_02:head_hair",
    "P3_primary_masses:pass_02:near_arm",
    "P3_primary_masses:pass_02:pelvis_legs",
    "P3_primary_masses:pass_02:torso_orientation",
    "P3_primary_masses:pass_03:attached_object",
    "P3_primary_masses:pass_03:far_arm",
    "P3_primary_masses:pass_03:head_hair",
    "P3_primary_masses:pass_03:near_arm",
    "P3_primary_masses:pass_03:pelvis_legs",
    "P3_primary_masses:pass_03:torso_orientation",
    "P3_primary_masses:pass_04:attached_object",
    "P3_primary_masses:pass_04:far_arm",
    "P3_primary_masses:pass_04:head_hair",
    "P3_primary_masses:pass_04:near_arm",
    "P3_primary_masses:pass_04:pelvis_legs",
    "P3_primary_masses:pass_04:torso_orientation",
    "P3_primary_masses:pass_05:attached_object",
    "P3_primary_masses:pass_05:far_arm",
    "P3_primary_masses:pass_05:head_hair",
    "P3_primary_masses:pass_05:near_arm",
    "P3_primary_masses:pass_05:pelvis_legs",
    "P3_primary_masses:pass_05:torso_orientation",
    "P3_primary_masses:pass_06:attached_object",
    "P3_primary_masses:pass_06:far_arm",
    "P3_primary_masses:pass_06:head_hair",
    "P3_primary_masses:pass_06:near_arm",
    "P3_primary_masses:pass_06:pelvis_legs",
    "P3_primary_masses:pass_06:torso_orientation"
  ],
  "abandoned_review_digests": {
    "P3_primary_masses": [
      "17b00eef56dc62c79a3f378df3edc5b83e6badddaeeb1e7696cd795532638f75",
      "20ef9bd512970687b2f8348fa1ae702830c46ba4466455883af126315b58b088",
      "10bceaf4931eb9ad1d7db88f995095783f50254b1b48affe875aa71b8ba6d806",
      "6c3e2ada242e66509646ae05df1e87e3749b4937914cfc0ae57a481cebb65e8b",
      "f8733173e9ff4d892be685497faebaf4f56f49b816027bc5839b8abbe58e48e4",
      "b24cee3068b1c7c4d53021fa77116ed0664a9435a5ec709f6d06172734d6e96d"
    ]
  },
  "archive_dir": "../../../../dev/p3_reference_run/run/reopen_archive/reopen_01",
  "discovered_in_stage": "P4_structural_connections",
  "findings": [
    "FAIL — torso orientation crop shows a rectangular mass with nearly horizontal depth cues.",
    "FAIL — pelvis/legs crop shows insufficient asymmetric taper and inter-leg negative space.",
    "FAIL — the head volume reads as a generic egg rather than a turned primary mass.",
    "FAIL — P3 must be rebuilt before any P4 connection or surface detail is allowed."
  ],
  "invalidated_stages": [
    "P3_primary_masses",
    "P4_structural_connections"
  ],
  "policy": "reopen_earliest_responsible_stage",
  "reason": "Fresh whole/crop/overlay audit found that the active P3 masses were a flat torso and rail-like legs, so P4 could only compensate for an upstream volume error.",
  "reopen_id": "reopen_01",
  "restored_cursor": 77,
  "restored_state_sha256": "60fbb4abf4365ec7d529523a8eda9cf8a4721b227e9134006e57da3bc7a3efc7",
  "schema": "img2drawing.reopen_record.v1",
  "semantic_authority": "agent",
  "source_cursor": 135,
  "source_state_sha256": "561a6e32a3589e8963ad28c589105f32fd651191101f0618a63404163d1cb6b6",
  "target_stage": "P3_primary_masses",
  "trigger_review_digest": null
}